<?xml version="1.0" encoding="UTF-8"?>  
<schedule xmlns="http://www.andrew.cmu.edu/mm6" xmlns:xsi="http://www.w3.org/2001/XMLSchema-instance"  xsi:schemaLocation="http://www.andrew.cmu.edu/mm6  
schedule.xsd"
>
<Monday>
   <openSlot>
     <start>09:00:00</start>
     <end>10:00:00</end>
   </openSlot>
   <openSlot>
       <start>13:00:00</start>
       <end>14:00:00</end>
   </openSlot>
</Monday>
 <Tuesday>  
	<openSlot>
       <start>18:58:00</start>
       <end>19:58:00</end>
   </openSlot>
	<openSlot>
       <start>21:58:00</start>
       <end>22:58:00</end>
   </openSlot>
</Tuesday>
<Wednesday>
   <openSlot>
       <start>09:00:00</start>
       <end>10:00:00</end>
   </openSlot>
   <openSlot>
       <start>11:00:00</start>
       <end>13:00:00</end>
   </openSlot>
   <openSlot>
       <start>14:00:00</start>
       <end>16:00:00</end>
   </openSlot>
</Wednesday>
<Thursday>
   <openSlot>
       <start>09:00:00</start>
       <end>10:00:00</end>
   </openSlot>
</Thursday>
<Friday>
   <openSlot>
       <start>11:00:00</start>
       <end>14:00:00</end>
   </openSlot>
</Friday>
<Saturday>
   <openSlot>
       <start>09:00:00</start>
       <end>10:00:00</end>
   </openSlot>
   <openSlot>
       <start>11:15:00</start>
       <end>12:15:00</end>
   </openSlot>
</Saturday>
<Sunday>
   <openSlot>
       <start>09:00:00</start>
       <end>10:00:00</end>
   </openSlot>
   <openSlot>
       <start>13:00:00</start>
       <end>17:00:00</end>
   </openSlot>
</Sunday>
</schedule>